{
  "id": "tahini-kekse",
  "title": "Tahini-Kekse",
  "category": "Kekse",
  "yield": {
    "amount": 25,
    "unit": "Stück"
  },
  "ingredients": [
    {
      "group": null,
      "amount": 250,
      "unit": "g",
      "name": "Mehl",
      "note": "2 Tassen"
    },
    {
      "group": null,
      "amount": 75,
      "unit": "g",
      "name": "Tahini",
      "note": "ca. 1/3 Tasse"
    },
    {
      "group": null,
      "amount": 150,
      "unit": "g",
      "name": "vegane Butter",
      "note": "ca. 1 1/3 Sticks"
    },
    {
      "group": null,
      "amount": 1,
      "unit": "g",
      "name": "Salz",
      "note": "1/4 TL"
    },
    {
      "group": null,
      "amount": 125,
      "unit": "g",
      "name": "Rohrohrzucker",
      "note": "ca. 1/2 Tasse"
    },
    {
      "group": null,
      "amount": 100,
      "unit": "g",
      "name": "schwarzer Sesam"
    },
    {
      "group": null,
      "amount": 100,
      "unit": "g",
      "name": "weißer Sesam"
    },
    {
      "group": null,
      "amount": null,
      "unit": null,
      "name": "Fleur de Sel",
      "note": "zum Bestreuen"
    }
  ],
  "steps": [
    "Mehl, Rohrohrzucker und Salz in einer Schüssel vermengen.",
    "Vegane Butter würfeln und zusammen mit dem Tahini zugeben.",
    "Alles verrühren, bis ein glatter Teig entsteht, und diesen zu einer Rolle formen.",
    "Schwarzen und weißen Sesam großzügig auf Frischhaltefolie streuen. Die Teigrolle darin wälzen, bis sie rundum mit Sesam bedeckt ist.",
    "In die Folie eingewickelt etwa 60 Minuten kalt stellen.",
    "Den Ofen auf 180 °C vorheizen.",
    "Die gekühlte Rolle in Scheiben schneiden und auf ein mit Backpapier belegtes Blech legen. Nach Belieben mit Fleur de Sel bestreuen.",
    "Etwa 15 Minuten backen, bis die Kekse goldbraun sind. Auskühlen lassen."
  ],
  "source": {
    "url": "https://www.zuckerjagdwurst.com/en/recipes/vegan-tahini-cookies"
  },
  "images": [
    "tahini-kekse.webp"
  ],
  "dateAdded": "2026-07-17"
}
