{
  "id": "reis-mit-bohnen",
  "title": "Reis mit Bohnen",
  "category": "Hauptgerichte",
  "yield": {
    "amount": 3,
    "unit": "Portionen"
  },
  "ingredients": [
    {
      "group": null,
      "amount": 150,
      "unit": "g",
      "name": "Reis"
    },
    {
      "group": null,
      "amount": 2,
      "unit": "Stück",
      "name": "Zwiebel(n)"
    },
    {
      "group": null,
      "amount": 1,
      "unit": "Stück",
      "name": "Paprikaschote"
    },
    {
      "group": null,
      "amount": 250,
      "unit": "g",
      "name": "Tomaten"
    },
    {
      "group": null,
      "amount": 3,
      "unit": "Stück",
      "name": "Knoblauchzehe(n)"
    },
    {
      "group": null,
      "amount": 1,
      "unit": "Dose",
      "name": "Bohnen"
    },
    {
      "group": null,
      "amount": 1,
      "unit": "Stück",
      "name": "kleine Dose Mais"
    },
    {
      "group": null,
      "amount": null,
      "unit": null,
      "name": "Salz und Pfeffer, schwarzer"
    },
    {
      "group": null,
      "amount": null,
      "unit": null,
      "name": "Kurkuma"
    },
    {
      "group": null,
      "amount": null,
      "unit": null,
      "name": "Öl"
    }
  ],
  "steps": [
    "Zuerst den Reis unter fließendem Wasser waschen, bis das Wasser klar bleibt.",
    "Die Zwiebel und die Paprikaschote in kleine Würfel schneiden.",
    "Die Tomaten klein schneiden.",
    "Dann die Zwiebelwürfel goldbraun anbraten und die Paprika und die Tomaten dazugeben.",
    "Nun den Knoblauch dazupressen.",
    "Den Reis und die Bohnen hinzugeben und mit Wasser angießen.",
    "Mit Salz und schwarzem Pfeffer würzen und 25 Minuten bei schwacher Hitze köcheln lassen, bis der Reis gar ist.",
    "Kurz vor Ende de Mais dazugeben."
  ],
  "source": {
    "url": "https://www.chefkoch.de/rezepte/893161194861815/Reis-mit-roten-Bohnen.html?utm_source=com.apple.UIKit.activity.CopyToPasteboard&amp;utm_medium=Social%2520Sharing%2520CTA&amp;utm_campaign=Sharing-iOS"
  },
  "images": [
    "reis-mit-bohnen.webp"
  ],
  "dateAdded": "2026-07-17"
}
