{
  "id": "veganer-stollen-mit-marzipan",
  "title": "Veganer Stollen mit Marzipan",
  "category": "Weihnachten",
  "yield": {
    "amount": 1,
    "unit": "Portionen"
  },
  "ingredients": [
    {
      "group": null,
      "amount": 500,
      "unit": "g",
      "name": "Mehl"
    },
    {
      "group": null,
      "amount": 1,
      "unit": "Pck.",
      "name": "Trockenhefe"
    },
    {
      "group": null,
      "amount": 130,
      "unit": "g",
      "name": "Zucker"
    },
    {
      "group": null,
      "amount": 1,
      "unit": "Msp.",
      "name": "Salz"
    },
    {
      "group": null,
      "amount": 10,
      "unit": "g",
      "name": "abgeriebene Zitrone (ungespritzt!)",
      "note": "entspricht 1 EL"
    },
    {
      "group": null,
      "amount": 200,
      "unit": "g",
      "name": "Pflanzenmargarine"
    },
    {
      "group": null,
      "amount": 200,
      "unit": "ml",
      "name": "Pflanzenmilch"
    },
    {
      "group": null,
      "amount": 200,
      "unit": "g",
      "name": "Sultaninen / Cranberries / getrocknete Aprikosen"
    },
    {
      "group": null,
      "amount": 100,
      "unit": "g",
      "name": "gemahlene Mandeln"
    },
    {
      "group": null,
      "amount": 100,
      "unit": "g",
      "name": "Marzipan"
    },
    {
      "group": null,
      "amount": null,
      "unit": null,
      "name": "Puderzucker"
    },
    {
      "group": null,
      "amount": 30,
      "unit": "g",
      "name": "Pflanzenmargarine",
      "note": "2-3; entspricht 2-3 EL"
    }
  ],
  "steps": [
    "Mehl mit Trockenhefe, Zucker und Salz mischen. Lauwarme Pflanzenmilch und weiche Margarine zugeben und zu einem geschmeidigen Hefeteig verkneten. Abgeriebene Zitronenschale und gemahlene Mandeln unterkneten.",
    "Sultaninen bzw. Trockenfrüchte unterarbeiten und den Teig abgedeckt an einem warmen Ort etwa 1 Stunde gehen lassen.",
    "Das Marzipan zu einer Rolle formen. Den Teig länglich ausrollen, das Marzipan mittig einlegen und den Stollen formen.",
    "Auf ein Blech setzen und bei 180 °C etwa 50–60 Minuten backen; bei zu starker Bräunung mit Backpapier abdecken.",
    "Den noch warmen Stollen mit 30 g geschmolzener Margarine bestreichen und dick mit Puderzucker bestäuben."
  ],
  "variations": [
    {
      "id": "stollenkonfekt",
      "title": "Stollenkonfekt",
      "description": "Kleine Konfektstücke mit Orangeat, Zitronat und Walnüssen statt eines ganzen Stollens mit Marzipan.",
      "yield": {
        "amount": 55,
        "unit": "Stück"
      },
      "ingredients": [
        {
          "group": null,
          "amount": 50,
          "unit": "g",
          "name": "Walnüsse"
        },
        {
          "group": null,
          "amount": 100,
          "unit": "g",
          "name": "Orangeat"
        },
        {
          "group": null,
          "amount": 100,
          "unit": "g",
          "name": "Zitronat"
        },
        {
          "group": null,
          "amount": 100,
          "unit": "g",
          "name": "Rosinen (oder Cranberrys)"
        },
        {
          "group": null,
          "amount": 100,
          "unit": "ml",
          "name": "Orangensaft"
        },
        {
          "group": "Für den Teig",
          "amount": 500,
          "unit": "g",
          "name": "Mehl"
        },
        {
          "group": "Für den Teig",
          "amount": 150,
          "unit": "g",
          "name": "Zucker"
        },
        {
          "group": "Für den Teig",
          "amount": 100,
          "unit": "g",
          "name": "gemahlene Mandeln"
        },
        {
          "group": "Für den Teig",
          "amount": 3,
          "unit": "g",
          "name": "Christstollengewürz",
          "note": "entspricht 1 TL"
        },
        {
          "group": "Für den Teig",
          "amount": 1,
          "unit": "Pck.",
          "name": "Trockenhefe",
          "note": "7 g"
        },
        {
          "group": "Für den Teig",
          "amount": 1,
          "unit": "Pck.",
          "name": "Vanillezucker",
          "note": "7 g"
        },
        {
          "group": "Für den Teig",
          "amount": 50,
          "unit": "ml",
          "name": "Pflanzenöl"
        },
        {
          "group": "Für den Teig",
          "amount": 200,
          "unit": "g",
          "name": "pflanzliche Butter"
        },
        {
          "group": "Für den Teig",
          "amount": 1.5,
          "unit": "g",
          "name": "Bittermandelaroma",
          "note": "entspricht 0.5 TL"
        },
        {
          "group": "Für den Teig",
          "amount": 150,
          "unit": "ml",
          "name": "pflanzliche Milch"
        },
        {
          "group": "Zum Servieren",
          "amount": null,
          "unit": null,
          "name": "Puderzucker"
        }
      ],
      "steps": [
        "Walnüsse hacken und zusammen mit Orangeat, Zitronat und Rosinen in eine Schüssel geben.",
        "Orangensaft dazugeben und das Ganze über Nacht ziehen lassen.",
        "Mehl, Zucker, gemahlene Mandeln, Christstollengewürz, Trockenhefe und Vanillezucker in einer Schüssel vermischen.",
        "Anschließend Pflanzenöl, pflanzliche Butter, Bittermandelaroma und pflanzliche Milch dazugeben.",
        "Die Zutaten zu einem leicht klebrigen Teig verkneten.",
        "Überschüssigen Orangensaft der eingeweichten Früchtemischung abgießen, die Mischung zum Teig geben und unterkneten. Dabei so viel Mehl wie nötig dazugeben, damit der Teig nicht mehr klebt.",
        "Den Teig ca. 30 Minuten an einem warmen Platz ruhen lassen.",
        "In der Zwischenzeit den Ofen auf 180°C (Umluft) vorheizen und ein Backblech mit Backpapier auslegen.",
        "Den Teig auf einer bemehlten Fläche ca. 2-3 cm dick ausrollen und in kleine Stücke schneiden.",
        "Die Stücke auf dem vorbereiteten Backblech verteilen – wahrscheinlich werden zwei Backbleche benötigt; entweder zwei Bleche in den Ofen schieben oder das Konfekt in Portionen backen.",
        "Das Stollenkonfekt ca. 13 Minuten backen. Es sollte an der Oberfläche noch nicht gebräunt und knusprig sein, sondern eher noch etwas zu weich wirken.",
        "Die kleinen Stücke auf einem Kuchengitter abkühlen lassen; danach ggf. die restlichen Stücke backen.",
        "Das Stollenkonfekt dick mit Puderzucker bestäuben und in einem luftdichten Behälter aufbewahren."
      ],
      "notes": "",
      "source": {
        "url": "https://www.zuckerjagdwurst.com/de/rezepte/veganes-stollenkonfekt"
      }
    }
  ],
  "notes": "Zubereitung aus den Zutaten rekonstruiert (im Original-Export fehlten die Schritte).",
  "source": {
    "url": "https://www.peta.de/rezepte/christstollen/"
  },
  "images": [
    "veganer-stollen-mit-marzipan.webp",
    "veganer-stollen-mit-marzipan-2.webp"
  ],
  "dateAdded": "2026-07-17"
}
