{
  "id": "gruene-bohnen-mit-raeuchertofu",
  "title": "Grüne Bohnen mit Räuchertofu",
  "category": "Hauptgerichte",
  "yield": {
    "amount": 2,
    "unit": "Personen"
  },
  "times": {
    "prep": "10 Minuten",
    "cook": "20 Minuten"
  },
  "ingredients": [
    { "group": null, "amount": 1, "unit": "Zehe", "name": "Knoblauch" },
    { "group": null, "amount": 15, "unit": "ml", "name": "Öl (z. B. Rapsöl)", "note": "entspricht 1 EL" },
    { "group": null, "amount": 400, "unit": "g", "name": "Buschbohnen" },
    { "group": null, "amount": 175, "unit": "g", "name": "Räuchertofu" },
    { "group": null, "amount": 15, "unit": "ml", "name": "Sojasoße", "note": "entspricht 1 EL" },
    { "group": null, "amount": 50, "unit": "ml", "name": "Wasser" },
    { "group": null, "amount": null, "unit": null, "name": "Salz" },
    { "group": "Optional", "amount": null, "unit": null, "name": "geröstetes Sesamöl" }
  ],
  "steps": [
    "Knoblauch schälen und in dünne Scheiben schneiden. Buschbohnen waschen, die Enden knapp abschneiden und die Bohnen halbieren.",
    "Die Bohnen in kochendem Salzwasser 3–4 Minuten vorkochen, abgießen und gut abtropfen lassen.",
    "Öl in einer Pfanne erhitzen und den Knoblauch anbraten, bis er duftet und goldbraun ist.",
    "Bohnen hinzugeben und bei mittlerer bis starker Hitze anbraten, bis sie etwas Farbe bekommen haben.",
    "Tofu und Sojasoße hinzufügen, verrühren und mit dem Wasser ablöschen. Sofort abdecken und dünsten, bis die Flüssigkeit verdampft ist.",
    "Sobald die Bohnen gar sind, nach Geschmack salzen und mit etwas Sesamöl beträufeln.",
    "Mit Reis oder einer Beilage nach Wahl servieren."
  ],
  "source": {
    "name": "madame végane",
    "url": "https://www.madamevegane.de/gruene-bohnen-mit-raeuchertofu/"
  },
  "images": [
    "gruene-bohnen-mit-raeuchertofu.webp"
  ],
  "dateAdded": "2026-09-23"
}
